{
  "$schema": "http://json-schema.org/draft-07/schema#",
  "$id": "https://github.com/nanko/spec-framework/schemas/config.schema.json",
  "title": "Spec Framework configuration",
  "description": "Configuration for the `spec` CLI (.specs/config.json). The canonical model in .specs/model/ is always the source of truth; `backends` lists remote mirrors only.",
  "type": "object",
  "additionalProperties": true,
  "properties": {
    "version": { "type": "integer", "const": 2 },
    "sourceOfTruth": {
      "type": "string",
      "const": "model",
      "description": "Always `model`: .specs/model/ holds the canonical artefacts."
    },
    "projections": {
      "type": "object",
      "additionalProperties": false,
      "properties": {
        "markdown": { "type": "boolean", "default": true, "description": "Generate the markdown projections under .specs/." }
      }
    },
    "backends": {
      "type": "array",
      "description": "Remote mirror backends. The local model is intrinsic and never listed here.",
      "items": {
        "type": "object",
        "required": ["id", "type"],
        "additionalProperties": true,
        "properties": {
          "id": { "type": "string", "description": "Unique mirror identifier (also the key used in artifact.remote)." },
          "type": { "type": "string", "description": "Backend implementation, e.g. linear, or an extensions/<id> folder." },
          "enabled": { "type": "boolean", "default": false },
          "settings": { "type": "object", "additionalProperties": true }
        }
      },
      "default": [{ "id": "linear", "type": "linear", "enabled": false }]
    }
  }
}

